{"$defs":{"capability":{"additionalProperties":false,"properties":{"capability_id":{"maxLength":64,"minLength":3,"type":"string"},"enabled":{"type":"boolean"},"required_for_actual":{"type":"boolean"},"required_for_dry_run":{"type":"boolean"},"support_status":{"enum":["supported","unsupported"]}},"required":["capability_id","enabled","required_for_actual","required_for_dry_run","support_status"],"type":"object"},"commit":{"pattern":"^[0-9a-f]{40}$","type":"string"},"component":{"additionalProperties":false,"properties":{"id":{"maxLength":64,"minLength":3,"type":"string"},"revision":{"$ref":"#/$defs/commit"},"version":{"maxLength":64,"minLength":1,"type":"string"}},"required":["id","version","revision"],"type":"object"},"digest":{"pattern":"^[0-9a-f]{64}$","type":"string"},"disabled":{"additionalProperties":false,"properties":{"automatic_updates":{"const":true},"browser":{"const":true},"dovetail":{"const":true},"honcho":{"const":true},"plugins":{"const":true},"rlm":{"const":true},"telemetry":{"const":true},"unrelated_network":{"const":true}},"required":["automatic_updates","browser","dovetail","honcho","plugins","rlm","telemetry","unrelated_network"],"type":"object"},"entry_component":{"additionalProperties":false,"properties":{"entrypoint":{"maxLength":128,"minLength":3,"type":"string"},"id":{"maxLength":64,"minLength":3,"type":"string"},"revision":{"$ref":"#/$defs/commit"},"version":{"maxLength":64,"minLength":1,"type":"string"}},"required":["id","version","revision","entrypoint"],"type":"object"},"non_evaluations":{"additionalProperties":false,"properties":{"advancement":{"const":"not_evaluated"},"application_quality":{"const":"not_evaluated"},"comparison":{"const":"not_run"},"factuality":{"const":"not_evaluated"},"feature_parity":{"const":"not_evaluated"},"hiring_outcomes":{"const":"not_evaluated"},"oracle":{"const":"not_run"},"quality":{"const":"not_evaluated"},"safety":{"const":"not_evaluated"},"scoring":{"const":"not_run"}},"required":["advancement","application_quality","comparison","factuality","feature_parity","hiring_outcomes","oracle","quality","safety","scoring"],"type":"object"},"runner":{"additionalProperties":false,"properties":{"entrypoint":{"const":"lib/recursus-route-worker-v13.mjs"},"id":{"const":"rc3-recursus-bridge-runner"},"version":{"const":"13.0.0"}},"required":["id","version","entrypoint"],"type":"object"},"string_list":{"items":{"maxLength":96,"minLength":3,"type":"string"},"maxItems":16,"minItems":1,"type":"array","uniqueItems":true}},"$schema":"https://json-schema.org/draft/2020-12/schema","additionalProperties":false,"properties":{"authority_profile":{"const":{"container_controls":{"capabilities":"all_dropped","child_process":"node_permission_denied","image_root":"read_only","no_new_privileges":true,"pids_limit":128,"worker_user":"65532:65532"},"credential_boundary":{"authority":"registered_runtime_only","document":"container:credentials/.credentials.yaml","host_values_observed":false,"mount":"credential_home_only_rw","owner_mode":"65532:65532:0600"},"filesystem_boundary":{"credential_home":"rw","evaluator_files_visible":false,"evidence_workspace_visible":false,"input":"ro","locks":"rw","output":"rw","seed_workspace":"ro"},"image":{"config_digest":"sha256:5f1133aa8981f19d096042799dd4379ccc100adfdbe69b06d97197ce70c980d6","descriptor_digest":"sha256:03f27cc9bc8be04121a47d4c1b469340ed93c0a6b072fc866de01b85204fd012","entrypoint":["/usr/local/bin/node"],"manifest_digest":"sha256:a04b3357d558ea6c1ea508434ee6b734abdbc76512cb52e50d2fffe09ec53a44","platform":"linux/amd64","reference":"recursus-rc3-v13@sha256:03f27cc9bc8be04121a47d4c1b469340ed93c0a6b072fc866de01b85204fd012","user":"65532:65532"},"network_boundary":{"allowed_connect_authorities":["auth.openai.com:443","chatgpt.com:443"],"application_fetch_observation":"exact_url_and_method_guard_without_headers_or_body","max_concurrent_tunnels":1,"max_oauth_refresh_connect_tunnels_per_adapter_request":2,"max_response_connect_tunnels_per_adapter_request":2,"provider_request_observation":"adapter_stream_and_dsh_agent_request_events","proxy":"fresh_external_bridge_connect_allowlist","relay":"network_none_loopback_to_owner_only_unix_socket","tls":"end_to_end_not_intercepted","wire_request_count":"unsupported_end_to_end_tls","worker":"relay_network_namespace_no_routes_no_socket_mount"},"trust_boundary":{"docker_daemon":"trusted_host_orchestrator","provider_response":"untrusted_until_normalized_and_validated","proxy_and_relay":"runner_registered_content_safe_observers","worker_output":"untrusted_until_host_reconciliation"}}},"benchmark":{"const":{"advancement_thresholds":"not_applicable_rc3_no_advancement","exclusions":[],"lane":"execution_route_conformance","question":"Can one accepted career-bench-v1 seed case traverse the pinned direct-adapter Recursus route and produce independently validated local evidence?"}},"budgets":{"additionalProperties":false,"properties":{"max_artifact_bytes":{"const":65536},"max_output_tokens":{"const":4096},"max_provider_requests":{"const":1},"timeout_ms":{"maximum":600000,"minimum":1000,"type":"integer"}},"required":["max_artifact_bytes","max_output_tokens","max_provider_requests","timeout_ms"],"type":"object"},"capabilities":{"items":{"$ref":"#/$defs/capability"},"maxItems":9,"minItems":9,"type":"array","uniqueItems":true},"contract_version":{"const":"rc3-recursus-direct-v13"},"contracts":{"const":{"fixture_version":"career-bench-v1","parser_version":"dsh-event-observer-v5","schema_version":"rc3-recursus-direct-v13","validator_version":"rc3-route-validator-v13"}},"corpus":{"additionalProperties":false,"properties":{"corpus_version":{"const":"career-bench-v1"},"scenario_id":{"const":"FACT-01"}},"required":["corpus_version","scenario_id"],"type":"object"},"deviations":{"$ref":"#/$defs/string_list"},"environment":{"const":{"node":"^22.19.0 || >=24.0.0","platforms":["windows-x64"]}},"expected_evidence":{"additionalProperties":false,"properties":{"artifact_path":{"const":"artifacts/assistant-output.md"},"authority_observation_path":{"const":"authority-observation.json"},"cleanup_attestation":{"const":"strict_docker_not_found_inspection"},"completed_actual_record_count":{"const":10},"completed_actual_record_paths":{"const":["artifact-inventory.json","artifacts/assistant-output.md","authority-observation.json","bridge-input.json","intent.json","normalized-result.json","seed-inventory.json","trace.json","worker-observation.json","workspace-inventory.json"]},"dry_run_record_count":{"const":8},"dry_run_record_paths":{"const":["artifact-inventory.json","artifacts/assistant-output.md","bridge-input.json","intent.json","normalized-result.json","seed-inventory.json","trace.json","workspace-inventory.json"]},"output_contract":{"const":"one_bounded_tailored_summary_markdown"},"request_byte_count":{"const":1931},"request_sha256":{"$ref":"#/$defs/digest"},"reservation_path":{"const":"actual-reservation.json"},"worker_observation_path":{"const":"worker-observation.json"}},"required":["artifact_path","output_contract","request_sha256","request_byte_count","reservation_path","authority_observation_path","completed_actual_record_count","completed_actual_record_paths","dry_run_record_count","dry_run_record_paths","worker_observation_path","cleanup_attestation"],"type":"object"},"milestone":{"const":"RC-3"},"non_evaluations":{"$ref":"#/$defs/non_evaluations"},"permissions":{"additionalProperties":false,"properties":{"browser":{"const":"disabled_enforced"},"evidence":{"const":"runner_only_external"},"external_apps":{"const":"disabled_enforced"},"network":{"const":"registered_connect_destinations_enforced"},"provider":{"const":"one_registered_adapter_request_enforced"},"workspace":{"const":"seed_workspace_read_only_enforced"}},"required":["workspace","evidence","network","provider","browser","external_apps"],"type":"object"},"policies":{"additionalProperties":false,"properties":{"credential_values":{"const":"runtime_managed_never_captured"},"disabled_features":{"$ref":"#/$defs/disabled"},"dry_run_offline":{"const":true},"oracle_evaluation":{"const":"not_run"},"validation_offline":{"const":true}},"required":["dry_run_offline","validation_offline","credential_values","oracle_evaluation","disabled_features"],"type":"object"},"product":{"const":{"base_revision":"03f557a3b3bea8eee11cdd31787849c35c4af135","id":"recursus-careers-evaluation-route","repository":"https://github.com/OpenCnid/recursus-careers","working_tree_state":"uncommitted_rc3_v13_runner_files_hashed"}},"registered_at":{"maxLength":32,"minLength":20,"pattern":"^\\d{4}-\\d{2}-\\d{2}T\\d{2}:\\d{2}:\\d{2}\\.\\d{3}Z$","type":"string"},"registration_id":{"const":"RC3-REC-DIRECT-2026-08-24-V13"},"route":{"additionalProperties":false,"properties":{"adapter":{"additionalProperties":false,"properties":{"entrypoint":{"const":"lib/index.js"},"id":{"const":"deepseek-openai-codex"},"revision":{"$ref":"#/$defs/commit"},"transport":{"const":"direct_adapter"},"version":{"const":"0.1.0"}},"required":["id","version","revision","entrypoint","transport"],"type":"object"},"control_plane":{"$ref":"#/$defs/entry_component"},"credential_reference":{"const":"OPENAI_CODEX_OAUTH"},"harness":{"$ref":"#/$defs/component"},"model":{"additionalProperties":false,"properties":{"id":{"const":"gpt-5.6-sol"},"reasoning_effort":{"const":"xhigh"},"snapshot":{"const":"gpt-5.6-sol"},"snapshot_representation":{"const":"configured_catalog_model_id"}},"required":["id","snapshot","snapshot_representation","reasoning_effort"],"type":"object"},"provider":{"additionalProperties":false,"properties":{"id":{"const":"openai-codex"},"provider_reported_model":{"const":"not_reported"}},"required":["id","provider_reported_model"],"type":"object"},"route_id":{"const":"recursus-direct-v13"},"runner":{"$ref":"#/$defs/runner"},"runtime":{"$ref":"#/$defs/component"}},"required":["route_id","runtime","harness","control_plane","runner","provider","adapter","model","credential_reference"],"type":"object"},"run_plan":{"const":{"actual_attempts":1,"dry_runs":1,"execution_order":["RC3-DRY-RUN-FACT-01-13","RC3-ATTEMPT-REC-DIRECT-V13-FACT-01-R01"],"repeats_per_case":1}},"schema_version":{"const":"1.0"},"source_snapshot":{"additionalProperties":false,"properties":{"path":{"const":"source-snapshot.json"},"snapshot_id":{"const":"RC3-SOURCE-SNAPSHOT-2026-08-24-V13"}},"required":["path","snapshot_id"],"type":"object"},"synthetic":{"const":true},"unsupported_capabilities":{"$ref":"#/$defs/string_list","maxItems":10,"minItems":10},"workflow":{"const":{"id":"rc3-minimal-bridge-input","instruction_bundle_sha256":"074a9208ee8568e48cf49f9f5c1b912a4ddf2904b0747fe65057d8908d1da73c","version":"2.0.0"}}},"required":["schema_version","registration_id","contract_version","registered_at","milestone","synthetic","corpus","route","environment","permissions","policies","budgets","capabilities","deviations","unsupported_capabilities","non_evaluations","expected_evidence","source_snapshot","benchmark","contracts","product","run_plan","workflow","authority_profile"],"type":"object"}
