{"authority_profile":{"container_controls":{"capabilities":"all_dropped","child_process":"node_permission_denied","image_root":"read_only","no_new_privileges":true,"pids_limit":128,"worker_user":"65532:65532"},"credential_boundary":{"authority":"registered_runtime_only","document":"container:credentials/.credentials.yaml","host_values_observed":false,"mount":"credential_home_only_rw","owner_mode":"65532:65532:0600"},"filesystem_boundary":{"credential_home":"rw","evaluator_files_visible":false,"evidence_workspace_visible":false,"input":"ro","locks":"rw","output":"rw","seed_workspace":"ro"},"image":{"config_digest":"sha256:5f1133aa8981f19d096042799dd4379ccc100adfdbe69b06d97197ce70c980d6","descriptor_digest":"sha256:03f27cc9bc8be04121a47d4c1b469340ed93c0a6b072fc866de01b85204fd012","entrypoint":["/usr/local/bin/node"],"manifest_digest":"sha256:a04b3357d558ea6c1ea508434ee6b734abdbc76512cb52e50d2fffe09ec53a44","platform":"linux/amd64","reference":"recursus-rc3-v13@sha256:03f27cc9bc8be04121a47d4c1b469340ed93c0a6b072fc866de01b85204fd012","user":"65532:65532"},"network_boundary":{"allowed_connect_authorities":["auth.openai.com:443","chatgpt.com:443"],"application_fetch_observation":"exact_url_and_method_guard_without_headers_or_body","max_concurrent_tunnels":1,"max_oauth_refresh_connect_tunnels_per_adapter_request":2,"max_response_connect_tunnels_per_adapter_request":2,"provider_request_observation":"adapter_stream_and_dsh_agent_request_events","proxy":"fresh_external_bridge_connect_allowlist","relay":"network_none_loopback_to_owner_only_unix_socket","tls":"end_to_end_not_intercepted","wire_request_count":"unsupported_end_to_end_tls","worker":"relay_network_namespace_no_routes_no_socket_mount"},"trust_boundary":{"docker_daemon":"trusted_host_orchestrator","provider_response":"untrusted_until_normalized_and_validated","proxy_and_relay":"runner_registered_content_safe_observers","worker_output":"untrusted_until_host_reconciliation"}},"benchmark":{"advancement_thresholds":"not_applicable_rc3_no_advancement","exclusions":[],"lane":"execution_route_conformance","question":"Can one accepted career-bench-v1 seed case traverse the pinned direct-adapter Recursus route and produce independently validated local evidence?"},"budgets":{"max_artifact_bytes":65536,"max_output_tokens":4096,"max_provider_requests":1,"timeout_ms":120000},"capabilities":[{"capability_id":"accepted_seed_ingestion","enabled":true,"required_for_actual":true,"required_for_dry_run":true,"support_status":"supported"},{"capability_id":"bounded_output_capture","enabled":true,"required_for_actual":true,"required_for_dry_run":true,"support_status":"supported"},{"capability_id":"bridge_input_construction","enabled":true,"required_for_actual":true,"required_for_dry_run":true,"support_status":"supported"},{"capability_id":"content_safe_trace","enabled":true,"required_for_actual":true,"required_for_dry_run":true,"support_status":"supported"},{"capability_id":"direct_adapter_transport","enabled":true,"required_for_actual":true,"required_for_dry_run":true,"support_status":"supported"},{"capability_id":"independent_validation","enabled":true,"required_for_actual":true,"required_for_dry_run":true,"support_status":"supported"},{"capability_id":"normalization","enabled":true,"required_for_actual":true,"required_for_dry_run":true,"support_status":"supported"},{"capability_id":"runner_manifest","enabled":true,"required_for_actual":true,"required_for_dry_run":true,"support_status":"supported"},{"capability_id":"runtime_authority_enforcement","enabled":true,"required_for_actual":true,"required_for_dry_run":false,"support_status":"supported"}],"contract_version":"rc3-recursus-direct-v13","contracts":{"fixture_version":"career-bench-v1","parser_version":"dsh-event-observer-v5","schema_version":"rc3-recursus-direct-v13","validator_version":"rc3-route-validator-v13"},"corpus":{"corpus_version":"career-bench-v1","scenario_id":"FACT-01"},"deviations":["RC3-DEV-MINIMAL-BRIDGE-INPUT","RC3-DEV-NONDURABLE-SINGLE-ATTEMPT","RC3-DEV-NONREPRODUCIBLE-PACKAGE-ORDER","RC3-DEV-ONE-BOUNDED-SUMMARY","RC3-DEV-TLS-WIRE-REQUEST-COUNT-UNOBSERVABLE"],"environment":{"node":"^22.19.0 || >=24.0.0","platforms":["windows-x64"]},"expected_evidence":{"artifact_path":"artifacts/assistant-output.md","authority_observation_path":"authority-observation.json","cleanup_attestation":"strict_docker_not_found_inspection","completed_actual_record_count":10,"completed_actual_record_paths":["artifact-inventory.json","artifacts/assistant-output.md","authority-observation.json","bridge-input.json","intent.json","normalized-result.json","seed-inventory.json","trace.json","worker-observation.json","workspace-inventory.json"],"dry_run_record_count":8,"dry_run_record_paths":["artifact-inventory.json","artifacts/assistant-output.md","bridge-input.json","intent.json","normalized-result.json","seed-inventory.json","trace.json","workspace-inventory.json"],"output_contract":"one_bounded_tailored_summary_markdown","request_byte_count":1931,"request_sha256":"074a9208ee8568e48cf49f9f5c1b912a4ddf2904b0747fe65057d8908d1da73c","reservation_path":"actual-reservation.json","worker_observation_path":"worker-observation.json"},"milestone":"RC-3","non_evaluations":{"advancement":"not_evaluated","application_quality":"not_evaluated","comparison":"not_run","factuality":"not_evaluated","feature_parity":"not_evaluated","hiring_outcomes":"not_evaluated","oracle":"not_run","quality":"not_evaluated","safety":"not_evaluated","scoring":"not_run"},"permissions":{"browser":"disabled_enforced","evidence":"runner_only_external","external_apps":"disabled_enforced","network":"registered_connect_destinations_enforced","provider":"one_registered_adapter_request_enforced","workspace":"seed_workspace_read_only_enforced"},"policies":{"credential_values":"runtime_managed_never_captured","disabled_features":{"automatic_updates":true,"browser":true,"dovetail":true,"honcho":true,"plugins":true,"rlm":true,"telemetry":true,"unrelated_network":true},"dry_run_offline":true,"oracle_evaluation":"not_run","validation_offline":true},"product":{"base_revision":"03f557a3b3bea8eee11cdd31787849c35c4af135","id":"recursus-careers-evaluation-route","repository":"https://github.com/OpenCnid/recursus-careers","working_tree_state":"uncommitted_rc3_v13_runner_files_hashed"},"registered_at":"2026-08-24T23:41:00.000Z","registration_id":"RC3-REC-DIRECT-2026-08-24-V13","route":{"adapter":{"entrypoint":"lib/index.js","id":"deepseek-openai-codex","revision":"5232102d0cc8bd55d5bf27b6eb203efbf6ada8a9","transport":"direct_adapter","version":"0.1.0"},"control_plane":{"entrypoint":"@deepseek-ai/dsh-agent-loop","id":"deepseek-harness","revision":"e52c224fe00954fb7e8cda19eb2411dceef15989","version":"dsh-v0.1.0-rc.7"},"credential_reference":"OPENAI_CODEX_OAUTH","harness":{"id":"recursus-rc3-minimal-harness","revision":"4444405e8b34124b1518fa2a66d0223e202234e4","version":"4.0.0"},"model":{"id":"gpt-5.6-sol","reasoning_effort":"xhigh","snapshot":"gpt-5.6-sol","snapshot_representation":"configured_catalog_model_id"},"provider":{"id":"openai-codex","provider_reported_model":"not_reported"},"route_id":"recursus-direct-v13","runner":{"entrypoint":"lib/recursus-route-worker-v13.mjs","id":"rc3-recursus-bridge-runner","version":"13.0.0"},"runtime":{"id":"recursus","revision":"4444405e8b34124b1518fa2a66d0223e202234e4","version":"0.0.0-foundation"}},"run_plan":{"actual_attempts":1,"dry_runs":1,"execution_order":["RC3-DRY-RUN-FACT-01-13","RC3-ATTEMPT-REC-DIRECT-V13-FACT-01-R01"],"repeats_per_case":1},"schema_version":"1.0","source_snapshot":{"path":"source-snapshot.json","snapshot_id":"RC3-SOURCE-SNAPSHOT-2026-08-24-V13"},"synthetic":true,"unsupported_capabilities":["ablations","compiled_prompt_parity","durable_execution_and_recovery","full_career_ops_feature_parity","honcho_enhancements","human_evaluation_and_scoring","reproducible_package_build","recursus_only_enhancements","rlm_enhancements","wire_level_request_count_attestation"],"workflow":{"id":"rc3-minimal-bridge-input","instruction_bundle_sha256":"074a9208ee8568e48cf49f9f5c1b912a4ddf2904b0747fe65057d8908d1da73c","version":"2.0.0"}}
